{
  "observationId": "synthetic:amd-systemic-clinical-c3d-ratio",
  "schemaName": "FledaQuantitativeObservation",
  "schemaVersion": "1.0.0",
  "source": {
    "pmid": null,
    "pmcid": null,
    "doi": "10.0000/fleda.synthetic.amd.systemic",
    "title": "Synthetic AMD systemic fixture for contract testing",
    "publicationYear": 2026,
    "sourceUrl": "https://complementtwin.com/synthetic-fixtures/amd-systemic",
    "contentHash": "sha256:1111111111111111111111111111111111111111111111111111111111111111",
    "retrievedAt": "2026-08-30T00:00:00Z",
    "accessType": "open_full_text",
    "license": "CC0-1.0"
  },
  "locator": {
    "sourceKind": "table",
    "section": "Synthetic results",
    "page": "1",
    "tableId": "Synthetic Table 1",
    "figureId": null,
    "panel": null,
    "rowLabel": "C3d/C3",
    "columnLabel": "AMD case",
    "caption": "Synthetic fixture only; not a published measurement.",
    "supportingExcerpt": null,
    "boundingBox": null,
    "axis": null
  },
  "biologicalContext": {
    "analyte": "C3d/C3 ratio",
    "canonicalEntityId": "fleda:complement:C3d_C3_ratio",
    "matrix": "plasma",
    "tissue": null,
    "compartment": "circulation",
    "species": "Homo sapiens",
    "strain": null,
    "cellType": null,
    "genotype": null,
    "disease": "age-related macular degeneration",
    "subtype": "non-neovascular AMD",
    "stage": "intermediate",
    "phenotype": "synthetic cohort endpoint",
    "spatialScope": "systemic",
    "experimentalSetting": "clinical"
  },
  "experiment": {
    "studyDesign": "synthetic cross-sectional case-control",
    "experimentalModel": "human cohort",
    "assay": "synthetic immunoassay",
    "assayManufacturer": null,
    "assayVersion": null,
    "lowerLimitOfQuantification": null,
    "cohort": "synthetic AMD cases",
    "sampleSize": 40,
    "replicateType": "participant",
    "replicateCount": 40,
    "groupId": "synthetic-amd-case",
    "groupLabel": "AMD case",
    "groupRole": "case",
    "comparisonId": "synthetic-amd-v-control",
    "pairedDesign": "unpaired",
    "baselineOrFollowup": "single_timepoint",
    "analysisSampleSize": 38,
    "intervention": null,
    "comparator": "healthy control",
    "dose": null,
    "doseUnit": null,
    "route": null,
    "duration": null,
    "durationUnit": null,
    "timepoint": 0,
    "timeUnit": "day",
    "timepointAnchor": "collection",
    "preAnalyticalConditions": { "anticoagulant": "reported in synthetic fixture" }
  },
  "measurement": {
    "endpoint": "plasma C3d/C3 ratio",
    "reportedStatistic": "mean",
    "value": 1.25,
    "reportedValueText": "1.25",
    "reportedUnit": "ratio",
    "unitCode": "1",
    "valueQualifier": "exact",
    "censored": false,
    "detectionLimit": null,
    "detectionLimitUnitCode": null,
    "variabilityType": "CI",
    "variabilityLower": 1.1,
    "variabilityUpper": 1.4,
    "variabilityValue": null,
    "pValue": 0.02,
    "effectEstimate": null,
    "effectEstimateType": null,
    "axisScale": "linear",
    "extractionOrigin": "table_cell",
    "digitizationError": null
  },
  "normalization": {
    "normalizedValue": 1.25,
    "normalizedUnit": "1",
    "canonicalEndpoint": "plasma_c3d_c3_ratio",
    "conversionRuleId": null,
    "conversionRuleVersion": null,
    "conversionInputs": null,
    "conversionFormula": null,
    "conversionStatus": "not_required"
  },
  "provenance": {
    "extractionMethod": "manual_import",
    "extractorName": "fleda-synthetic-fixture",
    "extractorVersion": "1.0.0",
    "extractedAt": "2026-08-30T00:00:00Z",
    "promptVersion": null,
    "reviewerName": "fleda-synthetic-review",
    "reviewerVersion": "1.0.0",
    "reviewedAt": "2026-08-30T00:01:00Z",
    "reviewResult": "supported",
    "ruleValidationResult": "passed",
    "validationIssues": [],
    "sourceImageHash": null
  },
  "governance": {
    "workflowState": "accepted_for_candidate_calibration",
    "uncertainty": "moderate",
    "calibrationEligible": true,
    "eligibilityReasons": ["ALL_DETERMINISTIC_GATES_PASSED"],
    "notApplicableReasons": [
      { "fieldPath": "experiment.intervention", "ruleId": "NON_INTERVENTIONAL_ENDPOINT", "reason": "Cross-sectional endpoint has no intervention." },
      { "fieldPath": "experiment.dose", "ruleId": "NON_INTERVENTIONAL_ENDPOINT", "reason": "Cross-sectional endpoint has no dose." },
      { "fieldPath": "experiment.route", "ruleId": "NON_INTERVENTIONAL_ENDPOINT", "reason": "Cross-sectional endpoint has no administration route." }
    ],
    "evidenceLevel": "synthetic_contract_fixture",
    "studyQualitySignals": ["complete_group_identity", "reported_uncertainty"],
    "formalModelChange": false,
    "candidateModelVersion": null
  }
}
