{
  "observationId": "synthetic:amd-local-ex-vivo-rpe-c3-fragment",
  "schemaName": "FledaQuantitativeObservation",
  "schemaVersion": "1.0.0",
  "source": {
    "pmid": null,
    "pmcid": null,
    "doi": "10.0000/fleda.synthetic.amd.local",
    "title": "Synthetic AMD local retinal fixture for contract testing",
    "publicationYear": 2026,
    "sourceUrl": "https://complementtwin.com/synthetic-fixtures/amd-local",
    "contentHash": "sha256:2222222222222222222222222222222222222222222222222222222222222222",
    "retrievedAt": "2026-08-30T00:00:00Z",
    "accessType": "open_full_text",
    "license": "CC0-1.0"
  },
  "locator": {
    "sourceKind": "figure",
    "section": "Synthetic results",
    "page": "2",
    "tableId": null,
    "figureId": "Synthetic Figure 1",
    "panel": "A",
    "rowLabel": null,
    "columnLabel": null,
    "caption": "Synthetic fixture only; not a published measurement.",
    "supportingExcerpt": null,
    "boundingBox": { "x": 0.1, "y": 0.2, "width": 0.4, "height": 0.3 },
    "axis": { "xLabel": "condition", "yLabel": "relative C3 fragment signal", "yUnit": "1", "yScale": "linear" }
  },
  "biologicalContext": {
    "analyte": "C3 fragment deposition",
    "canonicalEntityId": "fleda:complement:C3_fragment_deposition",
    "matrix": "tissue lysate",
    "tissue": "retina/RPE/choroid explant",
    "compartment": "RPE-Bruch membrane interface",
    "species": "Homo sapiens",
    "strain": null,
    "cellType": "retinal pigment epithelium",
    "genotype": null,
    "disease": "age-related macular degeneration",
    "subtype": "non-neovascular AMD",
    "stage": "advanced",
    "phenotype": "synthetic local complement deposition endpoint",
    "spatialScope": "local_tissue",
    "experimentalSetting": "ex_vivo"
  },
  "experiment": {
    "studyDesign": "synthetic explant comparison",
    "experimentalModel": "human retina/RPE/choroid explant",
    "assay": "synthetic quantitative immunofluorescence",
    "assayManufacturer": null,
    "assayVersion": null,
    "lowerLimitOfQuantification": null,
    "cohort": "synthetic AMD donor explants",
    "sampleSize": 12,
    "replicateType": "donor",
    "replicateCount": 12,
    "groupId": "synthetic-amd-explant",
    "groupLabel": "AMD explant",
    "groupRole": "case",
    "comparisonId": "synthetic-amd-explant-v-control",
    "pairedDesign": "unpaired",
    "baselineOrFollowup": "single_timepoint",
    "analysisSampleSize": 12,
    "intervention": null,
    "comparator": "non-AMD donor explant",
    "dose": null,
    "doseUnit": null,
    "route": null,
    "duration": 24,
    "durationUnit": "hour",
    "timepoint": 24,
    "timeUnit": "hour",
    "timepointAnchor": "stimulation",
    "preAnalyticalConditions": { "processing": "reported in synthetic fixture" }
  },
  "measurement": {
    "endpoint": "relative RPE C3 fragment deposition signal",
    "reportedStatistic": "median",
    "value": 1.4,
    "reportedValueText": "~1.4",
    "reportedUnit": "relative fluorescence units",
    "unitCode": "1",
    "valueQualifier": "approximate",
    "censored": false,
    "detectionLimit": null,
    "detectionLimitUnitCode": null,
    "variabilityType": "IQR",
    "variabilityLower": 1.2,
    "variabilityUpper": 1.6,
    "variabilityValue": null,
    "pValue": null,
    "effectEstimate": null,
    "effectEstimateType": null,
    "axisScale": "linear",
    "extractionOrigin": "figure_digitization",
    "digitizationError": 0.08
  },
  "normalization": {
    "normalizedValue": 1.4,
    "normalizedUnit": "1",
    "canonicalEndpoint": "rpe_c3_fragment_deposition_relative",
    "conversionRuleId": "synthetic-relative-signal-v1",
    "conversionRuleVersion": "1.0.0",
    "conversionInputs": { "referenceGroup": "synthetic-control-explant" },
    "conversionFormula": "reported relative signal",
    "conversionStatus": "validated"
  },
  "provenance": {
    "extractionMethod": "figure_digitization",
    "extractorName": "fleda-synthetic-fixture",
    "extractorVersion": "1.0.0",
    "extractedAt": "2026-08-30T00:00:00Z",
    "promptVersion": null,
    "reviewerName": "fleda-synthetic-review",
    "reviewerVersion": "1.0.0",
    "reviewedAt": "2026-08-30T00:01:00Z",
    "reviewResult": "supported",
    "ruleValidationResult": "passed",
    "validationIssues": [],
    "sourceImageHash": "sha256:3333333333333333333333333333333333333333333333333333333333333333"
  },
  "governance": {
    "workflowState": "accepted_for_candidate_calibration",
    "uncertainty": "high",
    "calibrationEligible": true,
    "eligibilityReasons": ["ALL_DETERMINISTIC_GATES_PASSED"],
    "notApplicableReasons": [
      { "fieldPath": "experiment.intervention", "ruleId": "NON_INTERVENTIONAL_ENDPOINT", "reason": "Synthetic observational comparison has no intervention." },
      { "fieldPath": "experiment.dose", "ruleId": "NON_INTERVENTIONAL_ENDPOINT", "reason": "Synthetic observational comparison has no dose." },
      { "fieldPath": "experiment.route", "ruleId": "NON_INTERVENTIONAL_ENDPOINT", "reason": "Synthetic observational comparison has no administration route." }
    ],
    "evidenceLevel": "synthetic_contract_fixture",
    "studyQualitySignals": ["precise_figure_locator", "digitization_error_reported"],
    "formalModelChange": false,
    "candidateModelVersion": null
  }
}
